{
    "metadata": {
    "version": "1.0.0",
    "status": "published",
    "createdAt": "2026-07-17T00:00:00Z",
    "updatedAt": "2026-07-17T00:00:00Z"
},

"identity": {
    "id": "2020-covid-crash",
    "officialName": "2020 Stock Market Crash (COVID-19 Pandemic)",
    "shortName": "COVID-19 Market Crash",
    "displayOrder": 6,
    "eventClass": "Pandemic",
    "category": "Global Health Crisis",
    "eventType": "Pandemic-Induced Market Crash",
    "severity": "VERY_HIGH",

    "countriesAffected": [
        "Global",
        "India"
    ],

    "primaryMarket": "NIFTY50",

    "secondaryMarkets": [
        "BANKNIFTY",
        "NIFTY PHARMA",
        "NIFTY IT",
        "NIFTY AUTO",
        "NIFTY FMCG",
        "INDIA VIX"
    ]
},

"timeline": {
    "analysisStart": "2020-01-01",
    "eventStart": "2020-02-20",
    "eventPeak": "2020-01-14",
    "peakPanicStart": "2020-03-12",
    "peakPanicEnd": "2020-03-23",
    "eventBottom": "2020-03-23",
    "recoveryStart": "2020-03-24",
    "recoveryEnd": "2020-11-09",

    "importantAnnouncements": [
        {
            "date": "2020-03-11",
            "title": "WHO Declares COVID-19 a Pandemic",
            "type": "International",
            "description": "The World Health Organization officially declared COVID-19 a global pandemic."
        },
        {
            "date": "2020-03-24",
            "title": "Nationwide Lockdown Announced",
            "type": "Government",
            "description": "Government of India announced a nationwide lockdown to contain the spread of COVID-19."
        },
        {
            "date": "2020-03-27",
            "title": "RBI Emergency Monetary Measures",
            "type": "Central Bank",
            "description": "RBI announced repo rate cuts, CRR reduction, liquidity support, loan moratorium, and targeted liquidity measures."
        },
        {
            "date": "2020-05-12",
            "title": "Atmanirbhar Bharat Package",
            "type": "Government",
            "description": "Government announced a comprehensive economic relief package to support businesses, MSMEs, and households."
        },
        {
            "date": "2020-11-09",
            "title": "Pfizer Vaccine Success",
            "type": "International",
            "description": "Positive vaccine trial results accelerated the recovery in global financial markets."
        }
    ]
},
"historicalContext": {
    "economicConditions": "India entered 2020 as one of the fastest-growing major economies, although growth had already begun slowing due to weakening domestic demand and stress in the financial sector. The economy remained fundamentally stable before the pandemic.",

    "marketConditions": "Indian equity markets were trading near record highs during January 2020. Valuations were relatively elevated following years of economic expansion and strong foreign investment inflows.",

    "politicalConditions": "The Government of India maintained a stable political environment with ongoing structural reforms focused on infrastructure, manufacturing, and digital transformation.",

    "bankingSystem": "The banking sector was recovering from the NBFC liquidity crisis and improving asset quality. Banks entered the pandemic with stronger regulatory oversight than during previous financial crises.",

    "regulatoryEnvironment": "SEBI, RBI, and financial institutions had well-established crisis management frameworks following reforms implemented after the 2008 Global Financial Crisis and the 2013 Taper Tantrum.",

    "globalEnvironment": "COVID-19 rapidly spread from China to the rest of the world, disrupting international trade, global supply chains, travel, and manufacturing. Financial markets experienced synchronized global panic.",

    "investorSentiment": "Investor sentiment shifted from optimism to extreme fear within weeks as uncertainty surrounding the pandemic intensified and governments imposed nationwide lockdowns.",

    "marketVulnerability": "Globalization, interconnected supply chains, dependence on mobility, and uncertainty regarding the duration of the pandemic amplified the market's vulnerability."
},

"rootCauses": {
    "primaryCauses": [
        "Global spread of COVID-19.",
        "Nationwide lockdowns and mobility restrictions.",
        "Collapse in consumer demand.",
        "Disruption of global supply chains."
    ],

    "secondaryCauses": [
        "Oil price volatility.",
        "Foreign Institutional Investor (FII) outflows.",
        "Business uncertainty.",
        "Collapse in international travel and tourism."
    ],

    "triggerEvent": {
        "date": "2020-03-11",
        "title": "WHO Declares COVID-19 a Global Pandemic",
        "description": "The World Health Organization officially declared COVID-19 a pandemic, accelerating panic across global financial markets."
    },

    "structuralCauses": [
        "High dependence on global trade.",
        "Interconnected financial markets.",
        "Reliance on international supply chains.",
        "Economic disruption caused by mandatory lockdowns."
    ]
},

"marketImpact": {
    "summary": "The COVID-19 pandemic triggered one of the fastest market crashes in history. NIFTY50 declined nearly 38% within weeks before recovering rapidly following unprecedented fiscal and monetary stimulus.",

    "marketReaction": "Circuit breakers were triggered, volatility reached record highs, and investors rapidly sold risk assets across global markets.",

    "investorBehaviour": "Institutional investors reduced equity exposure during the panic while retail participation increased significantly during the recovery phase.",

    "liquidityImpact": "Financial markets experienced severe liquidity stress initially before extraordinary central bank interventions restored confidence.",

    "sentimentChange": "Investor sentiment evolved from extreme fear during lockdowns to optimism following policy stimulus and successful vaccine developments."
},

"economicImpact": {
    "gdp": "India experienced its sharpest post-independence economic contraction, with GDP declining significantly during FY2020-21, including a record contraction in the first quarter.",

    "inflation": "Supply chain disruptions initially increased food inflation despite weaker consumer demand.",

    "interestRates": "RBI reduced policy rates aggressively to support economic activity and improve liquidity.",

    "exchangeRate": "The Indian Rupee depreciated during the initial market panic before stabilizing as financial conditions improved.",

    "employment": "Millions of jobs were temporarily affected, particularly in informal sectors, hospitality, aviation, tourism, and retail.",

    "industrialProduction": "Industrial production declined sharply because of nationwide lockdowns and factory closures.",

    "exports": "Exports contracted significantly because of weaker global demand and logistics disruptions.",

    "imports": "Imports declined due to weaker domestic demand and reduced industrial activity.",

    "consumerSpending": "Consumer spending collapsed during lockdowns before gradually recovering with reopening and government support.",

    "corporateEarnings": "Corporate earnings weakened sharply during lockdowns but recovered rapidly in technology, pharmaceuticals, and digital businesses.",

    "creditGrowth": "Credit demand slowed during the early stages of the pandemic before gradually recovering as economic activity resumed."
},
"governmentResponse": {
    "policies": [
        "Implemented one of the world's largest nationwide lockdowns to contain the spread of COVID-19.",
        "Launched the Atmanirbhar Bharat Abhiyan to support economic recovery and strengthen domestic manufacturing.",
        "Expanded food security through the Pradhan Mantri Garib Kalyan Anna Yojana (PMGKAY).",
        "Provided credit guarantees and financial assistance for MSMEs and vulnerable sectors."
    ],

    "fiscalMeasures": [
        "Announced the Atmanirbhar Bharat economic package worth approximately ₹20 lakh crore.",
        "Expanded welfare spending through Direct Benefit Transfers (DBT).",
        "Provided credit guarantee schemes for MSMEs.",
        "Extended tax filing deadlines and provided regulatory relief to businesses."
    ],

    "taxChanges": [
        "Deferred statutory compliance deadlines.",
        "Provided temporary GST and tax filing relief.",
        "Extended due dates for income tax returns and other regulatory filings."
    ],

    "emergencyActions": [
        "Nationwide lockdown beginning 25 March 2020.",
        "Emergency healthcare spending for testing, treatment, and vaccination preparation.",
        "Support for migrant workers and essential services.",
        "Phased reopening of economic activities under Unlock guidelines."
    ],

    "longTermReforms": [
        "Accelerated Make in India and Atmanirbhar Bharat initiatives.",
        "Strengthened digital governance and public service delivery.",
        "Expanded healthcare infrastructure.",
        "Accelerated digital transformation across industries."
    ]
},

"centralBankResponse": {
    "repoRate": "RBI reduced the Repo Rate from 5.15% to 4.00% during 2020 to support economic growth and improve financial conditions.",

    "reverseRepo": "Reverse Repo Rate was reduced to discourage banks from parking excess funds with the RBI and encourage lending.",

    "crr": "Cash Reserve Ratio was reduced from 4% to 3% to inject additional liquidity into the banking system.",

    "slr": "Statutory Liquidity Ratio remained largely unchanged while other liquidity measures were prioritized.",

    "liquidityMeasures": [
        "Targeted Long-Term Repo Operations (TLTRO).",
        "Open Market Operations (OMO).",
        "Special liquidity facilities for mutual funds.",
        "Liquidity support for NBFCs and financial institutions.",
        "Long-Term Repo Operations (LTRO)."
    ],